{
  "$schema": "https://json-schema.org/draft/2020-12/schema",
  "$id": "https://github.com/cataggar/wamr/tests/benchmarks/keyvault/manifest.schema.json",
  "title": "Pinned keyvault/TCGC benchmark manifest",
  "type": "object",
  "additionalProperties": false,
  "required": ["schema_version", "tools", "sources", "workload", "perf"],
  "properties": {
    "schema_version": { "const": 1 },
    "tools": {
      "type": "object",
      "additionalProperties": false,
      "required": ["wamr", "wamrc", "wasmtime"],
      "properties": {
        "wamr": { "$ref": "#/$defs/tool" },
        "wamrc": { "$ref": "#/$defs/tool" },
        "wasmtime": { "$ref": "#/$defs/tool" }
      }
    },
    "sources": {
      "type": "array",
      "minItems": 1,
      "items": { "$ref": "#/$defs/source" }
    },
    "workload": {
      "type": "object",
      "additionalProperties": false,
      "required": [
        "component",
        "preopens_file",
        "mounts",
        "package_name",
        "env",
        "expected_tcgc_response_bytes"
      ],
      "properties": {
        "component": { "$ref": "#/$defs/file" },
        "preopens_file": { "$ref": "#/$defs/file" },
        "mounts": {
          "type": "array",
          "minItems": 2,
          "items": {
            "type": "object",
            "additionalProperties": false,
            "required": ["path", "guest", "sha256_tree"],
            "properties": {
              "path": { "type": "string", "minLength": 1 },
              "guest": { "type": "string", "pattern": "^/" },
              "sha256_tree": { "$ref": "#/$defs/sha256" }
            }
          }
        },
        "package_name": { "type": "string", "minLength": 1 },
        "env": {
          "type": "object",
          "additionalProperties": { "type": "string" },
          "propertyNames": {
            "minLength": 1,
            "not": { "pattern": "=" }
          }
        },
        "expected_tcgc_response_bytes": {
          "type": "integer",
          "minimum": 1
        }
      }
    },
    "perf": {
      "type": "object",
      "additionalProperties": false,
      "required": [
        "core_index",
        "hot_func",
        "min_samples",
        "min_attribution_coverage_pct",
        "base"
      ],
      "properties": {
        "core_index": { "type": "integer", "minimum": 0 },
        "hot_func": {
          "oneOf": [
            { "type": "integer", "minimum": 0 },
            { "type": "null" }
          ]
        },
        "min_samples": { "type": "integer", "minimum": 1000 },
        "min_attribution_coverage_pct": {
          "type": "number",
          "exclusiveMinimum": 0,
          "maximum": 100
        },
        "base": {
          "oneOf": [
            { "type": "string", "pattern": "^0x[0-9a-fA-F]+$" },
            { "type": "null" }
          ]
        }
      }
    }
  },
  "$defs": {
    "sha256": {
      "type": "string",
      "pattern": "^[0-9a-f]{64}$"
    },
    "file": {
      "type": "object",
      "additionalProperties": false,
      "required": ["path", "sha256"],
      "properties": {
        "path": { "type": "string", "minLength": 1 },
        "sha256": { "$ref": "#/$defs/sha256" }
      }
    },
    "tool": {
      "type": "object",
      "additionalProperties": false,
      "required": ["path", "sha256", "version"],
      "properties": {
        "path": { "type": "string", "minLength": 1 },
        "sha256": { "$ref": "#/$defs/sha256" },
        "version": { "type": "string", "minLength": 1 }
      }
    },
    "source": {
      "type": "object",
      "additionalProperties": false,
      "required": ["name", "path", "revision"],
      "properties": {
        "name": { "type": "string", "minLength": 1 },
        "path": { "type": "string", "minLength": 1 },
        "revision": {
          "type": "string",
          "pattern": "^[0-9a-f]{40}$"
        }
      }
    }
  }
}
